{
  "pack_id": "PACK_20260319_192211_1a2c0b72",
  "timestamp": "2026-03-20T01:22:11.052380+00:00",
  "status": "healthy",
  "source_briefs": "BRIEF_20260319_192002_ef2f6b36",
  "packs": [
    {
      "script_id": "SCR_4d67851d60b6",
      "prompts": [
        {
          "asset_id": "ASSET_4d67851d_thumbnail_00_b7334e28",
          "asset_type": "thumbnail",
          "prompt": "YouTube video thumbnail, TechCrunch\u00a0Startup Battlefield 200 nominations\u00a0are, professional style, professional quality, eye-catching, high contrast text area, clean lines, corporate aesthetic, soft shadows",
          "negative_prompt": "blurry, low quality, distorted text, amateur, watermark, logo, cluttered, noisy, oversaturated, underexposed",
          "target_specs": {
            "width": 1280,
            "height": 720,
            "aspect": "16:9"
          },
          "style_tokens": [
            "clean lines",
            "corporate aesthetic",
            "soft shadows",
            "neutral tones",
            "minimal design"
          ],
          "safe_text_overlays": [
            "TechCrunch\u00a0Startup Battlefield"
          ]
        },
        {
          "asset_id": "ASSET_4d67851d_intro_card_00_15f7d8de",
          "asset_type": "intro_card",
          "prompt": "Video intro title card, TechCrunch\u00a0Startup Battlefield 200 nominations\u00a0are, professional motion graphics style, sleek animation ready, clean lines, corporate aesthetic, soft shadows",
          "negative_prompt": "blurry, low quality, distorted text, amateur, watermark, logo, cluttered, noisy, oversaturated, underexposed",
          "target_specs": {
            "width": 1920,
            "height": 1080,
            "aspect": "16:9"
          },
          "style_tokens": [
            "clean lines",
            "corporate aesthetic",
            "soft shadows",
            "neutral tones",
            "minimal design"
          ],
          "safe_text_overlays": [
            "TechCrunch\u00a0Startup Battlefield"
          ]
        },
        {
          "asset_id": "ASSET_4d67851d_lower_third_00_c238cbee",
          "asset_type": "lower_third",
          "prompt": "Lower third graphic, HOOK: Hook, professional style, semi-transparent background, modern typography, clean lines, corporate aesthetic, soft shadows",
          "negative_prompt": "blurry, low quality, distorted text, amateur, watermark, logo, cluttered, noisy, oversaturated, underexposed",
          "target_specs": {
            "width": 1920,
            "height": 200,
            "aspect": "wide"
          },
          "style_tokens": [
            "clean lines",
            "corporate aesthetic",
            "soft shadows",
            "neutral tones",
            "minimal design"
          ],
          "safe_text_overlays": [
            "TechCrunch\u00a0Startup Battlefield",
            "HOOK: Hook"
          ]
        },
        {
          "asset_id": "ASSET_4d67851d_lower_third_01_31447df2",
          "asset_type": "lower_third",
          "prompt": "Lower third graphic, CONTEXT: Context, professional style, semi-transparent background, modern typography, clean lines, corporate aesthetic, soft shadows",
          "negative_prompt": "blurry, low quality, distorted text, amateur, watermark, logo, cluttered, noisy, oversaturated, underexposed",
          "target_specs": {
            "width": 1920,
            "height": 200,
            "aspect": "wide"
          },
          "style_tokens": [
            "clean lines",
            "corporate aesthetic",
            "soft shadows",
            "neutral tones",
            "minimal design"
          ],
          "safe_text_overlays": [
            "TechCrunch\u00a0Startup Battlefield",
            "CONTEXT: Context"
          ]
        },
        {
          "asset_id": "ASSET_4d67851d_lower_third_02_027a15a2",
          "asset_type": "lower_third",
          "prompt": "Lower third graphic, DETAILS: Details, professional style, semi-transparent background, modern typography, clean lines, corporate aesthetic, soft shadows",
          "negative_prompt": "blurry, low quality, distorted text, amateur, watermark, logo, cluttered, noisy, oversaturated, underexposed",
          "target_specs": {
            "width": 1920,
            "height": 200,
            "aspect": "wide"
          },
          "style_tokens": [
            "clean lines",
            "corporate aesthetic",
            "soft shadows",
            "neutral tones",
            "minimal design"
          ],
          "safe_text_overlays": [
            "TechCrunch\u00a0Startup Battlefield",
            "DETAILS: Details"
          ]
        },
        {
          "asset_id": "ASSET_4d67851d_broll_00_c74bcdb0",
          "asset_type": "broll",
          "prompt": "B-roll footage, Attention-grabbing tech visuals, glitch effects, professional cinematography, professional grade, 4K quality, clean lines, corporate aesthetic, soft shadows",
          "negative_prompt": "blurry, low quality, distorted text, amateur, watermark, logo, cluttered, noisy, oversaturated, underexposed",
          "target_specs": {
            "width": 1920,
            "height": 1080,
            "aspect": "16:9",
            "fps": 30,
            "duration": 5.0
          },
          "style_tokens": [
            "clean lines",
            "corporate aesthetic",
            "soft shadows",
            "neutral tones",
            "minimal design"
          ],
          "safe_text_overlays": [
            "TechCrunch\u00a0Startup Battlefield",
            "HOOK: Hook"
          ]
        },
        {
          "asset_id": "ASSET_4d67851d_broll_01_eb8d2540",
          "asset_type": "broll",
          "prompt": "B-roll footage, Historical footage, timeline graphics, professional cinematography, professional grade, 4K quality, clean lines, corporate aesthetic, soft shadows",
          "negative_prompt": "blurry, low quality, distorted text, amateur, watermark, logo, cluttered, noisy, oversaturated, underexposed",
          "target_specs": {
            "width": 1920,
            "height": 1080,
            "aspect": "16:9",
            "fps": 30,
            "duration": 5.0
          },
          "style_tokens": [
            "clean lines",
            "corporate aesthetic",
            "soft shadows",
            "neutral tones",
            "minimal design"
          ],
          "safe_text_overlays": [
            "TechCrunch\u00a0Startup Battlefield",
            "CONTEXT: Context"
          ]
        },
        {
          "asset_id": "ASSET_4d67851d_broll_02_b3db18c3",
          "asset_type": "broll",
          "prompt": "B-roll footage, Product shots, UI demos, data visualizations, professional cinematography, professional grade, 4K quality, clean lines, corporate aesthetic, soft shadows",
          "negative_prompt": "blurry, low quality, distorted text, amateur, watermark, logo, cluttered, noisy, oversaturated, underexposed",
          "target_specs": {
            "width": 1920,
            "height": 1080,
            "aspect": "16:9",
            "fps": 30,
            "duration": 5.0
          },
          "style_tokens": [
            "clean lines",
            "corporate aesthetic",
            "soft shadows",
            "neutral tones",
            "minimal design"
          ],
          "safe_text_overlays": [
            "TechCrunch\u00a0Startup Battlefield",
            "DETAILS: Details"
          ]
        },
        {
          "asset_id": "ASSET_4d67851d_broll_03_d414612f",
          "asset_type": "broll",
          "prompt": "B-roll footage, Charts, graphs, expert-style talking head frame, professional cinematography, professional grade, 4K quality, clean lines, corporate aesthetic, soft shadows",
          "negative_prompt": "blurry, low quality, distorted text, amateur, watermark, logo, cluttered, noisy, oversaturated, underexposed",
          "target_specs": {
            "width": 1920,
            "height": 1080,
            "aspect": "16:9",
            "fps": 30,
            "duration": 5.0
          },
          "style_tokens": [
            "clean lines",
            "corporate aesthetic",
            "soft shadows",
            "neutral tones",
            "minimal design"
          ],
          "safe_text_overlays": [
            "TechCrunch\u00a0Startup Battlefield",
            "ANALYSIS: Analysis"
          ]
        },
        {
          "asset_id": "ASSET_4d67851d_broll_04_7ff3da89",
          "asset_type": "broll",
          "prompt": "B-roll footage, Key point graphics, summary card, professional cinematography, professional grade, 4K quality, clean lines, corporate aesthetic, soft shadows",
          "negative_prompt": "blurry, low quality, distorted text, amateur, watermark, logo, cluttered, noisy, oversaturated, underexposed",
          "target_specs": {
            "width": 1920,
            "height": 1080,
            "aspect": "16:9",
            "fps": 30,
            "duration": 5.0
          },
          "style_tokens": [
            "clean lines",
            "corporate aesthetic",
            "soft shadows",
            "neutral tones",
            "minimal design"
          ],
          "safe_text_overlays": [
            "TechCrunch\u00a0Startup Battlefield",
            "TAKEAWAY: Takeaway"
          ]
        },
        {
          "asset_id": "ASSET_4d67851d_title_card_00_04789dd4",
          "asset_type": "title_card",
          "prompt": "Section title card, HOOK: Hook, professional design, minimal clean layout, clean lines, corporate aesthetic, soft shadows",
          "negative_prompt": "blurry, low quality, distorted text, amateur, watermark, logo, cluttered, noisy, oversaturated, underexposed",
          "target_specs": {
            "width": 1920,
            "height": 1080,
            "aspect": "16:9"
          },
          "style_tokens": [
            "clean lines",
            "corporate aesthetic",